Armadillos, raccoons &amp; other varmints often have to be removed from the bayou areas of this most populous Texas city~Houston~BAYOU TRAP-ISTRY~200~J~Erin Barry, a Ph.D. student from Maplewood, Missouri~Show #8071 - Monday, October 14, 2019
The type of trap seen <a href="http://www.j-archive.com/media/2019-10-14_J_26.jpg" target="_blank">here</a> in Louisiana is meant to ensnare <a href="http://www.j-archive.com/media/2019-10-14_J_26.jpg" target="_blank">these</a>, also known as mud bugs~crayfish~BAYOU TRAP-ISTRY~400~J~Erin Barry, a Ph.D. student from Maplewood, Missouri~Show #8071 - Monday, October 14, 2019
The state of Louisiana says these reptiles over 4' can be considered a nuisance &amp; will give you the name of a hunter~alligators~BAYOU TRAP-ISTRY~600~J~Anthony Pinggera, a civil rights lawyer from Los Angeles, California~Show #8071 - Monday, October 14, 2019
You can catch turtles as they're basking on a log in the Bayou sun, a habit due to being ectothermic, also known as this~cold-blooded~BAYOU TRAP-ISTRY~800~J~Anthony Pinggera, a civil rights lawyer from Los Angeles, California~Show #8071 - Monday, October 14, 2019
"Rodents of Unusual Size" is a documentary about these animals, once valued for pelts but now destroying southern wetlands~nutria~BAYOU TRAP-ISTRY~1000~J~Anthony Pinggera, a civil rights lawyer from Los Angeles, California~Show #8071 - Monday, October 14, 2019
Let's turn our winter into mega-winter in this region that's about 75% of Russia's area; we love a brisk -80º day!~Siberia~LET'S LIVE ABROAD~200~J~Susan White, a bookseller from Norwich, Vermont (whose 1-day cash winnings total $8,700)~Show #8071 - Monday, October 14, 2019
...But not too far abroad! This border city about 15 miles south of San Diego will keep us close to the good ol' USA~Tijuana~LET'S LIVE ABROAD~400~J~Anthony Pinggera, a civil rights lawyer from Los Angeles, California~Show #8071 - Monday, October 14, 2019
We'll add ourselves to the 2.6 million in this most populous city in Canada; West Queen West is a happening area~Toronto~LET'S LIVE ABROAD~600~J~Erin Barry, a Ph.D. student from Maplewood, Missouri~Show #8071 - Monday, October 14, 2019
As this city hosted the Olympics in '92 &amp; Hans Christian Andersen called it the "Paris of Spain", I say we give it a shot~Barcelona~LET'S LIVE ABROAD~800~J~Erin Barry, a Ph.D. student from Maplewood, Missouri~Show #8071 - Monday, October 14, 2019
With salons of Armani &amp; Versace &amp; the super-ritzy "Golden Rectangle" of fashion in the center of this Italian city...ciao!~Milan~LET'S LIVE ABROAD~1000~J~Anthony Pinggera, a civil rights lawyer from Los Angeles, California~Show #8071 - Monday, October 14, 2019
Including whoopers, this is "a family of large birds with long legs and a long neck"~cranes~I READ IT IN THE <em class="underline">WORLD BOOK</em>~400~J~Anthony Pinggera, a civil rights lawyer from Los Angeles, California~Show #8071 - Monday, October 14, 2019
This "is the only planet that cannot be seen without a telescope"~Neptune~I READ IT IN THE <em class="underline">WORLD BOOK</em>~600~J~Anthony Pinggera, a civil rights lawyer from Los Angeles, California~Show #8071 - Monday, October 14, 2019
This "is a rough sport because the players kick and wrestle or sometimes hold an opponent's head underwater"~water polo~I READ IT IN THE <em class="underline">WORLD BOOK</em>~800~J~Erin Barry, a Ph.D. student from Maplewood, Missouri~Show #8071 - Monday, October 14, 2019
He "(1889?-1950), was the most famous male dancer of his time"~Nijinsky~I READ IT IN THE <em class="underline">WORLD BOOK</em>~1000~J~Anthony Pinggera, a civil rights lawyer from Los Angeles, California~Show #8071 - Monday, October 14, 2019
Double talk word for a low, constant stream of noise or speech~murmur~SPEAK SOFTLY~200~J~Triple Stumper~Show #8071 - Monday, October 14, 2019
Kids, you're within the walls of the house, not out in the park, so stop shouting &amp; "use your" this~inside voice~SPEAK SOFTLY~400~J~Erin Barry, a Ph.D. student from Maplewood, Missouri~Show #8071 - Monday, October 14, 2019
These 6-letter "tones" are used when speaking softly &amp; reverently~hushed~SPEAK SOFTLY~600~J~Erin Barry, a Ph.D. student from Maplewood, Missouri~Show #8071 - Monday, October 14, 2019
These 5-letter "tones" are subdued colors in clothing &amp; decor~muted~SPEAK SOFTLY~800~J~Anthony Pinggera, a civil rights lawyer from Los Angeles, California~Show #8071 - Monday, October 14, 2019
In an opera score, instructions telling a singer to hold back include mezza voce &amp; this voce~sotto~SPEAK SOFTLY~1000~J~Erin Barry, a Ph.D. student from Maplewood, Missouri~Show #8071 - Monday, October 14, 2019
"Star Wars" fans were crushed by her 2016 passing, followed a day later by her mother's~Carrie Fisher~&amp; CARRIE~200~J~Anthony Pinggera, a civil rights lawyer from Los Angeles, California~Show #8071 - Monday, October 14, 2019
Andie MacDowell played Carrie, the American girl who captures Hugh Grant's heart, in this 1994 film~<i>Four Weddings and a Funeral</i>~&amp; CARRIE~400~J~Triple Stumper~Show #8071 - Monday, October 14, 2019
In 2005 she became the first country singer to win "American Idol"~Carrie Underwood~&amp; CARRIE~600~J~Erin Barry, a Ph.D. student from Maplewood, Missouri~Show #8071 - Monday, October 14, 2019
In a 1976 film, she played Carrie White, whose prom night was quite memorable~Sissy Spacek~&amp; CARRIE~800~J~Erin Barry, a Ph.D. student from Maplewood, Missouri~Show #8071 - Monday, October 14, 2019
Fred <a href="http://www.j-archive.com/media/2019-10-14_J_12.jpg" target="_blank">Armisen</a> and <a href="http://www.j-archive.com/media/2019-10-14_J_12a.jpg" target="_blank">this</a> Carrie were costars and co-creators of "Portlandia"~Carrie Brownstein~&amp; CARRIE~1000~J~Erin Barry, a Ph.D. student from Maplewood, Missouri~Show #8071 - Monday, October 14, 2019
Drowning is the most common death for those doing this, the most dangerous job in the U.S. as per a 2019 newspaper report~fishing~A BIG STATISTIC~400~J~Triple Stumper~Show #8071 - Monday, October 14, 2019
Logitech did a survey that found that almost half the time the remote control was lost, it was found here~under the sofa cushion~A BIG STATISTIC~600~J~Susan White, a bookseller from Norwich, Vermont (whose 1-day cash winnings total $8,700)~Show #8071 - Monday, October 14, 2019
The haze that gives it its 3-word name doesn't keep visitors from making it our most visited national park~Great Smoky Mountains~A BIG STATISTIC~800~J~Anthony Pinggera, a civil rights lawyer from Los Angeles, California~Show #8071 - Monday, October 14, 2019
BLK on the NYSE, it has more than 6 trillion dollars in assets under management, more than any other firm~BlackRock~A BIG STATISTIC~1000~J~Triple Stumper~Show #8071 - Monday, October 14, 2019
A cantilevered auditorium is one feature of this hall of fame designed by Pei on Lake Erie in Cleveland~the Rock &amp; Roll Hall of Fame~THE MANY BUILDINGS OF I.M. PEI~400~DJ~Erin Barry, a Ph.D. student from Maplewood, Missouri~Show #8071 - Monday, October 14, 2019
The triangular prisms Pei designed for the Bank of China <a href="http://www.j-archive.com/media/2019-10-14_DJ_28.jpg" target="_blank">Tower</a>, make it stand out among the crowded <a href="http://www.j-archive.com/media/2019-10-14_DJ_28a.jpg" target="_blank">skyline</a> of this city~Hong Kong~THE MANY BUILDINGS OF I.M. PEI~1200~DJ~Anthony Pinggera, a civil rights lawyer from Los Angeles, California~Show #8071 - Monday, October 14, 2019
2 of I.M. Pei's early designs to be built were at an airport &amp; a presidential library both honoring this man~(John F.) Kennedy~THE MANY BUILDINGS OF I.M. PEI~1600~DJ~Susan White, a bookseller from Norwich, Vermont (whose 1-day cash winnings total $8,700)~Show #8071 - Monday, October 14, 2019
Pei was in his 90s when the Museum of Islamic Art on Doha Bay opened in <a href="http://www.j-archive.com/media/2019-10-14_DJ_29.jpg" target="_blank">this</a> country in 2008~Qatar~THE MANY BUILDINGS OF I.M. PEI~2000~DJ~Erin Barry, a Ph.D. student from Maplewood, Missouri~Show #8071 - Monday, October 14, 2019
She first hit the charts in 1985 with "You Give Good Love" &amp; "Saving All My Love For You"~Whitney Houston~LOVE SONGS~400~DJ~Anthony Pinggera, a civil rights lawyer from Los Angeles, California~Show #8071 - Monday, October 14, 2019
In "Perfect" he sings, "I'm dancing in the dark, with you between my arms, barefoot on the grass"~Ed Sheeran~LOVE SONGS~800~DJ~Erin Barry, a Ph.D. student from Maplewood, Missouri~Show #8071 - Monday, October 14, 2019
In a song inspired by his future wife, he sings, "All of me loves all of you, love your curves and all your edges"~John Legend~LOVE SONGS~1200~DJ~Erin Barry, a Ph.D. student from Maplewood, Missouri~Show #8071 - Monday, October 14, 2019
They breathed life into songs like "All Out Of Love" &amp; "Lost In Love"~Air Supply~LOVE SONGS~1600~DJ~Triple Stumper~Show #8071 - Monday, October 14, 2019
The melody for this Elvis hit was borrowed from a Civil War tune called "Aura Lee"~"Love Me Tender"~LOVE SONGS~2000~DJ~Erin Barry, a Ph.D. student from Maplewood, Missouri~Show #8071 - Monday, October 14, 2019
The 1814 Treaty of Ghent said the U.S. is "desirous" to promote the abolition of traffic in these~slaves~THE TREATY SAYS SO~400~DJ~Anthony Pinggera, a civil rights lawyer from Los Angeles, California~Show #8071 - Monday, October 14, 2019
The 1796 Treaty of Tripoli: "The government of the (United States) is not in any sense founded on" this "religion"~Christianity~THE TREATY SAYS SO~800~DJ~Anthony Pinggera, a civil rights lawyer from Los Angeles, California~Show #8071 - Monday, October 14, 2019
The 1903 Hay-Bunau-Varilla Treaty gave the U.S. "control of a zone" of this country where Bunau-Varilla became a hated man~Panama~THE TREATY SAYS SO~1200~DJ~Anthony Pinggera, a civil rights lawyer from Los Angeles, California~Show #8071 - Monday, October 14, 2019
The Treaty of Versailles said "The construction or acquisition of any submarine... shall be forbidden in" this country~Germany~THE TREATY SAYS SO~1600~DJ~Anthony Pinggera, a civil rights lawyer from Los Angeles, California~Show #8071 - Monday, October 14, 2019
This is the only Great Lake not mentioned in the Paris Peace Treaty of 1783 with Great Britain~Lake Michigan~THE TREATY SAYS SO~2000~DJ~Triple Stumper~Show #8071 - Monday, October 14, 2019
The federal laureate position is technically called "Poet Laureate Consultant in Poetry" by this library~the Library of Congress~AMERICAN POETS LAUREATE~400~DJ~Susan White, a bookseller from Norwich, Vermont (whose 1-day cash winnings total $8,700)~Show #8071 - Monday, October 14, 2019
This "Chicago" poet was Illinois' poet laureate in the last years of his life from 1962 to 1967~Carl Sandburg~AMERICAN POETS LAUREATE~800~DJ~Triple Stumper~Show #8071 - Monday, October 14, 2019
Colorado laureate Milford Shields must have been surprised when the governor also made this singer laureate in 1974~John Denver~AMERICAN POETS LAUREATE~1200~DJ~Susan White, a bookseller from Norwich, Vermont (whose 1-day cash winnings total $8,700)~Show #8071 - Monday, October 14, 2019
In 1998 Lawrence Ferlinghetti was made this city's first poet laureate~San Francisco~AMERICAN POETS LAUREATE~1600~DJ~~Show #8071 - Monday, October 14, 2019
In 2019 Joy Harjo of the Muscogee Creek Nation of this state was named the first Native American poet laureate~Oklahoma~AMERICAN POETS LAUREATE~2000~DJ~Erin Barry, a Ph.D. student from Maplewood, Missouri~Show #8071 - Monday, October 14, 2019
October 18, this state's day, commemorates the 1867 transfer of territory from Russia to the United States~Alaska~5 DAYS IN OCTOBER~400~DJ~Erin Barry, a Ph.D. student from Maplewood, Missouri~Show #8071 - Monday, October 14, 2019
October 16 is National Feral this animal day--remember to spay &amp; neuter!~cats~5 DAYS IN OCTOBER~800~DJ~Susan White, a bookseller from Norwich, Vermont (whose 1-day cash winnings total $8,700)~Show #8071 - Monday, October 14, 2019
In 2014, a time of increased pressure from Russia, Pres. Poroshenko made October 14 this country's Defender Day~Ukraine~5 DAYS IN OCTOBER~1200~DJ~Erin Barry, a Ph.D. student from Maplewood, Missouri~Show #8071 - Monday, October 14, 2019
October 15 is El Gran Día in Ávila, Spain as it's this saint's feast day~Teresa of Avila~5 DAYS IN OCTOBER~1600~DJ~Susan White, a bookseller from Norwich, Vermont (whose 1-day cash winnings total $8,700)~Show #8071 - Monday, October 14, 2019
On October 17 people in this Caribbean country celebrate national icon Jean-Jacques Dessalines~Haiti~5 DAYS IN OCTOBER~2000~DJ~Susan White, a bookseller from Norwich, Vermont (whose 1-day cash winnings total $8,700)~Show #8071 - Monday, October 14, 2019
Where wine grapes are grown~a vineyard~"V"-8~400~DJ~Erin Barry, a Ph.D. student from Maplewood, Missouri~Show #8071 - Monday, October 14, 2019
An exceptional, highly skilled musician, Italian style~a virtuoso~"V"-8~800~DJ~Susan White, a bookseller from Norwich, Vermont (whose 1-day cash winnings total $8,700)~Show #8071 - Monday, October 14, 2019
It was a 1982 Top 10 hit for the Go-Go's~"Vacation"~"V"-8~1200~DJ~Erin Barry, a Ph.D. student from Maplewood, Missouri~Show #8071 - Monday, October 14, 2019
It means abnormally swollen or dilated, like certain veins~varicose~"V"-8~1600~DJ~Anthony Pinggera, a civil rights lawyer from Los Angeles, California~Show #8071 - Monday, October 14, 2019
Borrowed from German, it means "not allowed"~verboden or verboten~"V"-8~2000~DJ~Erin Barry, a Ph.D. student from Maplewood, Missouri~Show #8071 - Monday, October 14, 2019
Fittingly, the symbols for the 4 elements in sodium citrate, which can make cheese melt easier, spell this 5-letter food~nacho~CHEMICAL SYMBOL WORDPLAY~ ~FJ~~Show #8071 - Monday, October 14, 2019