In June 1503, during his fourth voyage, this man &amp; his remaining crew members were marooned on Jamaica~Christopher Columbus~EXPLORERS~200~J~Dmitriy Pikovskiy, a medical student from Glenview, Illinois~Show #8072 - Tuesday, October 15, 2019
A sea off Alaska is named for this Danish explorer~(Vitus) Bering~EXPLORERS~400~J~Erin Barry, a Ph.D. student from Maplewood, Missouri (whose 1-day cash winnings total $20,400)~Show #8072 - Tuesday, October 15, 2019
Around 980 he sailed west &amp; named the land he found Greenland~Erik the Red~EXPLORERS~600~J~Dmitriy Pikovskiy, a medical student from Glenview, Illinois~Show #8072 - Tuesday, October 15, 2019
As part of the topographical corps of the U.S. Army, this "Pathfinder" surveyed the upper Missouri River~(John C.) Fremont~EXPLORERS~800~J~Ed Condon, a retired business intelligence manager from Hastings-on-Hudson, New York~Show #8072 - Tuesday, October 15, 2019
In 1855 he saw the falls Africans called Mosi-oa-Tunya ("smoke that thunders"), which he renamed for his queen~(Dr.) Livingstone~EXPLORERS~1000~J~Ed Condon, a retired business intelligence manager from Hastings-on-Hudson, New York~Show #8072 - Tuesday, October 15, 2019
Though Minnesota is known as the "Land of 10,000" of these, the state's being modest as usual--about 12,000 is more accurate~lakes~MINNESOTA...NICE~200~J~Ed Condon, a retired business intelligence manager from Hastings-on-Hudson, New York~Show #8072 - Tuesday, October 15, 2019
At this facility you can visit the Sea Life Minnesota Aquarium &amp; do a little shopping, too~the Mall of America~MINNESOTA...NICE~400~J~Ed Condon, a retired business intelligence manager from Hastings-on-Hudson, New York~Show #8072 - Tuesday, October 15, 2019
Paisley Park, his home &amp; recording studio, is in Chanhassen, a suburb of his hometown of Minneapolis~Prince~MINNESOTA...NICE~600~J~Ed Condon, a retired business intelligence manager from Hastings-on-Hudson, New York~Show #8072 - Tuesday, October 15, 2019
Last name of the dad and two <a href="http://www.j-archive.com/media/2019-10-15_J_14.jpg" target="_blank">sons</a> who began caring for patients at St. Mary's Hospital in Rochester, Minnesota in 1889~Mayo~MINNESOTA...NICE~800~J~Dmitriy Pikovskiy, a medical student from Glenview, Illinois~Show #8072 - Tuesday, October 15, 2019
The temperature falls in Minnesota, especially in these "Falls" that claim the title "Icebox of the Nation"~International Falls~MINNESOTA...NICE~1000~J~Dmitriy Pikovskiy, a medical student from Glenview, Illinois~Show #8072 - Tuesday, October 15, 2019
One definition of these trends is an "amusing mass involvement" that's short-lived; Hula Hoops &amp; smiley faces are 2 examples~a fad~SOCIOLOGIST'S GLOSSARY~200~J~Dmitriy Pikovskiy, a medical student from Glenview, Illinois~Show #8072 - Tuesday, October 15, 2019
From the Latin for "absorbed", it's the process by which immigrants are absorbed into the majority culture~assimilation~SOCIOLOGIST'S GLOSSARY~400~J~Dmitriy Pikovskiy, a medical student from Glenview, Illinois~Show #8072 - Tuesday, October 15, 2019
The counterpart of a certain ceiling, this type of floor prevents screwups born into privilege from falling too far socioeconomically~the glass floor~SOCIOLOGIST'S GLOSSARY~600~J~Erin Barry, a Ph.D. student from Maplewood, Missouri (whose 1-day cash winnings total $20,400)~Show #8072 - Tuesday, October 15, 2019
Like orders of angels, it's the arrangement of positions in rank order, with those below reporting to those above~hierarchy~SOCIOLOGIST'S GLOSSARY~800~J~Ed Condon, a retired business intelligence manager from Hastings-on-Hudson, New York~Show #8072 - Tuesday, October 15, 2019
To us, it means a too-complex system of rules, but to Max Weber, it was an ideal type of hypothetical organization~bureaucracy~SOCIOLOGIST'S GLOSSARY~1000~J~Ed Condon, a retired business intelligence manager from Hastings-on-Hudson, New York~Show #8072 - Tuesday, October 15, 2019
In 2005 Robin Roberts began co-anchoring this show, "GMA" for short~<i>Good Morning America</i>~TV MORNING SHOWS~200~J~Dmitriy Pikovskiy, a medical student from Glenview, Illinois~Show #8072 - Tuesday, October 15, 2019
The road in the title of CNBC's "Squawk on the Street" is this one &amp; they cover the day there from the opening bell~Wall Street~TV MORNING SHOWS~400~J~Ed Condon, a retired business intelligence manager from Hastings-on-Hudson, New York~Show #8072 - Tuesday, October 15, 2019
Ana Patricia Gámez helps wake up the USA's Spanish speakers on "Despierta América" on this TV network~Univision~TV MORNING SHOWS~600~J~Ed Condon, a retired business intelligence manager from Hastings-on-Hudson, New York~Show #8072 - Tuesday, October 15, 2019
Groundbreaking female hosts of this morning show that premiered in 1952 include Jane Pauley &amp; Barbara Walters~the <i>TODAY Show</i>~TV MORNING SHOWS~800~J~Ed Condon, a retired business intelligence manager from Hastings-on-Hudson, New York~Show #8072 - Tuesday, October 15, 2019
She co-hosts MSNBC's "Morning Joe"~Mika Brzezinski~TV MORNING SHOWS~1000~J~Dmitriy Pikovskiy, a medical student from Glenview, Illinois~Show #8072 - Tuesday, October 15, 2019
Tarana Burke actually coined this phrase more than a decade ago as a way to help survivors of sexual abuse~me too~I'VE GOT 2 WORDS FOR YOU~200~J~Ed Condon, a retired business intelligence manager from Hastings-on-Hudson, New York~Show #8072 - Tuesday, October 15, 2019
In 2015 Illinois mandated that polling places pass out stickers with these 2 words on Election Day~I voted~I'VE GOT 2 WORDS FOR YOU~400~J~Erin Barry, a Ph.D. student from Maplewood, Missouri (whose 1-day cash winnings total $20,400)~Show #8072 - Tuesday, October 15, 2019
Got milk? Maybe you shouldn't if you're this &amp; have trouble digesting the sugar that's found in it~lactose intolerant~I'VE GOT 2 WORDS FOR YOU~600~J~Erin Barry, a Ph.D. student from Maplewood, Missouri (whose 1-day cash winnings total $20,400)~Show #8072 - Tuesday, October 15, 2019
Dry cleaning got its name because this is not a big part of the process; liquid chemicals are used~water~DRY CLEANING~200~J~Erin Barry, a Ph.D. student from Maplewood, Missouri (whose 1-day cash winnings total $20,400)~Show #8072 - Tuesday, October 15, 2019
Back in the day, dry cleaning used chemicals including gasoline &amp; this other petroleum product AKA lamp oil~kerosene~DRY CLEANING~400~J~Dmitriy Pikovskiy, a medical student from Glenview, Illinois~Show #8072 - Tuesday, October 15, 2019
(<a href="http://www.j-archive.com/media/2019-10-15_J_18.jpg" target="_blank">Jimmy of the Clue Crew displays a dry cleaning bag.</a>) Clothes left in plastic dry cleaning bags for extended periods are, due to moisture buildup, subject to these two "M"s, both forms of fungi, so don't leave them in too long~mold &amp; mildew~DRY CLEANING~600~J~Ed Condon, a retired business intelligence manager from Hastings-on-Hudson, New York~Show #8072 - Tuesday, October 15, 2019
Perchloroethylene is dry cleaners' go-to as this 7-letter word that makes stains go away~a solvent~DRY CLEANING~800~J~Ed Condon, a retired business intelligence manager from Hastings-on-Hudson, New York~Show #8072 - Tuesday, October 15, 2019
This substance that gives wine &amp; coffee their astringency also leads to tough stains; special detergents help~tannins~DRY CLEANING~1000~J~Ed Condon, a retired business intelligence manager from Hastings-on-Hudson, New York~Show #8072 - Tuesday, October 15, 2019
The codex, an early form of the modern book, began replacing this less wieldy form early in the first millennium A.D.~a scroll~THAT CODEX MOMENT~400~DJ~Ed Condon, a retired business intelligence manager from Hastings-on-Hudson, New York~Show #8072 - Tuesday, October 15, 2019
The Codex Vaticanus &amp; the codex named for this mount are the earliest known manuscripts of the Bible~Mount Sinai~THAT CODEX MOMENT~800~DJ~Ed Condon, a retired business intelligence manager from Hastings-on-Hudson, New York~Show #8072 - Tuesday, October 15, 2019
The Madrid Codex is one of a handful of this Mesoamerican culture's hieroglyphic texts to survive 16th C. Spanish burnings~the Maya~THAT CODEX MOMENT~1200~DJ~Erin Barry, a Ph.D. student from Maplewood, Missouri (whose 1-day cash winnings total $20,400)~Show #8072 - Tuesday, October 15, 2019
The 13th century Codex Regius, containing the Elder Edda, is a national treasure of this country~Iceland~THAT CODEX MOMENT~1600~DJ~Ed Condon, a retired business intelligence manager from Hastings-on-Hudson, New York~Show #8072 - Tuesday, October 15, 2019
The 6th century codex of this great Byzantine Emperor was a compilation &amp; distillation of Roman law~Justinian~THAT CODEX MOMENT~2000~DJ~Ed Condon, a retired business intelligence manager from Hastings-on-Hudson, New York~Show #8072 - Tuesday, October 15, 2019
This reality show returned to MTV in 2019, with Spencer &amp; Heidi now parents~<i>The Hills</i>~POP CULTURE~400~DJ~Erin Barry, a Ph.D. student from Maplewood, Missouri (whose 1-day cash winnings total $20,400)~Show #8072 - Tuesday, October 15, 2019
This alliterative MMORPG released a "Classic" version in 2019 that returns players to Azeroth prior to its many expansions~World of Warcraft~POP CULTURE~800~DJ~Erin Barry, a Ph.D. student from Maplewood, Missouri (whose 1-day cash winnings total $20,400)~Show #8072 - Tuesday, October 15, 2019
Taylor Swift's song "Me!" features Brendon Urie of this band that's got an exclamation point in its name!~Panic! at the Disco~POP CULTURE~1200~DJ~Erin Barry, a Ph.D. student from Maplewood, Missouri (whose 1-day cash winnings total $20,400)~Show #8072 - Tuesday, October 15, 2019
In "John Wick: Chapter 3", Keanu kicks butt with Sofia, played by this Oscar-winning actress~Halle Berry~POP CULTURE~1600~DJ~Dmitriy Pikovskiy, a medical student from Glenview, Illinois~Show #8072 - Tuesday, October 15, 2019
In the comics this town is the rural residence of Li'l Abner~Dogpatch~POP CULTURE~2000~DJ~Ed Condon, a retired business intelligence manager from Hastings-on-Hudson, New York~Show #8072 - Tuesday, October 15, 2019
Czech writer Karel Capek wrote the play "R.U.R.". short for "Rossum's Universal" these automata~robots~AUTOMATONS~400~DJ~Erin Barry, a Ph.D. student from Maplewood, Missouri (whose 1-day cash winnings total $20,400)~Show #8072 - Tuesday, October 15, 2019
Talos was a mythical giant automaton made of this tin/copper alloy to protect Crete~bronze~AUTOMATONS~800~DJ~Ed Condon, a retired business intelligence manager from Hastings-on-Hudson, New York~Show #8072 - Tuesday, October 15, 2019
This 2011 Martin Scorsese movie is based on a Brian Selznick book about a boy who fixes an automaton with a secret message~<i>Hugo</i>~AUTOMATONS~1200~DJ~Erin Barry, a Ph.D. student from Maplewood, Missouri (whose 1-day cash winnings total $20,400)~Show #8072 - Tuesday, October 15, 2019
In Offenbach's opera "Tales of" this man, the writer falls in love with an automaton named Olympia~Hoffmann~AUTOMATONS~1600~DJ~Ed Condon, a retired business intelligence manager from Hastings-on-Hudson, New York~Show #8072 - Tuesday, October 15, 2019
The Hebrew name of this creature made of clay is also a word for an automaton~a golem~AUTOMATONS~2000~DJ~Dmitriy Pikovskiy, a medical student from Glenview, Illinois~Show #8072 - Tuesday, October 15, 2019
It describes your peepers when they've caught the red eye~bloodshot~OH OH, 3 O'S~400~DJ~Ed Condon, a retired business intelligence manager from Hastings-on-Hudson, New York~Show #8072 - Tuesday, October 15, 2019
Short but demanding type of race, seen <a href="http://www.j-archive.com/media/2019-10-15_DJ_20.wmv">here</a>~motocross~OH OH, 3 O'S~800~DJ~Ed Condon, a retired business intelligence manager from Hastings-on-Hudson, New York~Show #8072 - Tuesday, October 15, 2019
The scientific field of Franz Boas &amp; Margaret Mead~anthropology~OH OH, 3 O'S~1200~DJ~Erin Barry, a Ph.D. student from Maplewood, Missouri (whose 1-day cash winnings total $20,400)~Show #8072 - Tuesday, October 15, 2019
It's the Royal Navy rank just below Rear Admiral~Commodore~OH OH, 3 O'S~1600~DJ~Erin Barry, a Ph.D. student from Maplewood, Missouri (whose 1-day cash winnings total $20,400)~Show #8072 - Tuesday, October 15, 2019
You'll give a piece of your mind with this brain-cutting operation~lobotomy~OH OH, 3 O'S~2000~DJ~Erin Barry, a Ph.D. student from Maplewood, Missouri (whose 1-day cash winnings total $20,400)~Show #8072 - Tuesday, October 15, 2019
Circleville, Ohio is famous for its fall festival feting these gourds; the biggest one in 2018 was over 1,600 pounds~a pumpkin~FALL-POURRI~400~DJ~Ed Condon, a retired business intelligence manager from Hastings-on-Hudson, New York~Show #8072 - Tuesday, October 15, 2019
Fall is perfect for <a href="http://www.j-archive.com/media/2019-10-15_DJ_08.jpg" target="_blank">this</a> type of activity that the two kids in <a href="http://www.j-archive.com/media/2019-10-15_DJ_08a.jpg" target="_blank">this</a> painting are enjoying~a hayride~FALL-POURRI~800~DJ~Erin Barry, a Ph.D. student from Maplewood, Missouri (whose 1-day cash winnings total $20,400)~Show #8072 - Tuesday, October 15, 2019
1978's "Autumn Sonata" was the last feature film for this actress who won her first Oscar for "Gaslight" in 1945~Ingrid Bergman~FALL-POURRI~1200~DJ~Ed Condon, a retired business intelligence manager from Hastings-on-Hudson, New York~Show #8072 - Tuesday, October 15, 2019
The American Meteorological Society defines it as "a period, in mid- or late autumn, of abnormally warm weather"~Indian summer~FALL-POURRI~1600~DJ~Ed Condon, a retired business intelligence manager from Hastings-on-Hudson, New York~Show #8072 - Tuesday, October 15, 2019
Don't fear the reaper or this person, found in Keats' "To Autumn", who gathers the grain the reaper has left behind~the Gleaner~FALL-POURRI~2000~DJ~Ed Condon, a retired business intelligence manager from Hastings-on-Hudson, New York~Show #8072 - Tuesday, October 15, 2019
A blue plaque shows the Soho location where John Logie Baird, a claimant as the inventor of this medium, first demoed it in 1926~television~LONDON'S BLUE PLAQUES~400~DJ~Ed Condon, a retired business intelligence manager from Hastings-on-Hudson, New York~Show #8072 - Tuesday, October 15, 2019
Though she fought plaque, Lilian Lindsay would have liked the one that honors her as Britain's 1st woman in this profession~a dentist~LONDON'S BLUE PLAQUES~800~DJ~Erin Barry, a Ph.D. student from Maplewood, Missouri (whose 1-day cash winnings total $20,400)~Show #8072 - Tuesday, October 15, 2019
He could have said, "I need the 2-wheeled carriage or 'cab' named for me to take me home to 27 Sumner Place"~(Joseph) Hansom~LONDON'S BLUE PLAQUES~1200~DJ~Ed Condon, a retired business intelligence manager from Hastings-on-Hudson, New York~Show #8072 - Tuesday, October 15, 2019
A play &amp; 2 movies were titled "The Barretts of" this street &amp; that's where Elizabeth Barrett Browning's plaque is~Wimpole Street~LONDON'S BLUE PLAQUES~1600~DJ~Ed Condon, a retired business intelligence manager from Hastings-on-Hudson, New York~Show #8072 - Tuesday, October 15, 2019
This composer of "The Planets" has a plaque on St. Paul's Girls' School, where he taught &amp; which is still operating~Gustav Holst~LONDON'S BLUE PLAQUES~2000~DJ~~Show #8072 - Tuesday, October 15, 2019
In her only kids' book, she says, "There was Rose. Rose was her name &amp; would she have been Rose if her name had not been Rose"~Gertrude Stein~20th CENTURY AMERICAN WOMEN~ ~FJ~~Show #8072 - Tuesday, October 15, 2019